smartctl 6.5 (build date Apr  5 2017) [x86_64-linux-3.10.102] (local build)
Copyright (C) 2002-16, Bruce Allen, Christian Franke, www.smartmontools.org

=== START OF INFORMATION SECTION ===
Model Family:     Western Digital Red
Device Model:     WDC WD30EFRX-68AX9N0
Serial Number:    WD-WCC1T0363939
LU WWN Device Id: 5 0014ee 20819bf18
Firmware Version: 80.00A80
User Capacity:    3,000,592,982,016 bytes [3.00 TB]
Sector Sizes:     512 bytes logical, 4096 bytes physical
Device is:        In smartctl database [for details use: -P show]
ATA Version is:   ACS-2 (minor revision not indicated)
SATA Version is:  SATA 3.0, 6.0 Gb/s (current: 3.0 Gb/s)
Local Time is:    Thu Jun  8 22:23:39 2017 CST
SMART support is: Available - device has SMART capability.
SMART support is: Enabled

=== START OF READ SMART DATA SECTION ===
SMART overall-health self-assessment test result: PASSED

General SMART Values:
Offline data collection status:  (0x00)	Offline data collection activity
					was never started.
					Auto Offline Data Collection: Disabled.
Self-test execution status:      ( 247)	Self-test routine in progress...
					70% of test remaining.
Total time to complete Offline 
data collection: 		(39360) seconds.
Offline data collection
capabilities: 			 (0x7b) SMART execute Offline immediate.
					Auto Offline data collection on/off support.
					Suspend Offline collection upon new
					command.
					Offline surface scan supported.
					Self-test supported.
					Conveyance Self-test supported.
					Selective Self-test supported.
SMART capabilities:            (0x0003)	Saves SMART data before entering
					power-saving mode.
					Supports SMART auto save timer.
Error logging capability:        (0x01)	Error logging supported.
					General Purpose Logging supported.
Short self-test routine 
recommended polling time: 	 (   2) minutes.
Extended self-test routine
recommended polling time: 	 ( 395) minutes.
Conveyance self-test routine
recommended polling time: 	 (   5) minutes.
SCT capabilities: 	       (0x70bd)	SCT Status supported.
					SCT Error Recovery Control supported.
					SCT Feature Control supported.
					SCT Data Table supported.

SMART Attributes Data Structure revision number: 16
Vendor Specific SMART Attributes with Thresholds:
ID# ATTRIBUTE_NAME                                                   FLAG     VALUE WORST THRESH TYPE      UPDATED  WHEN_FAILED RAW_VALUE
  1 Raw_Read_Error_Rate                                              0x002f   200   200   051    Pre-fail  Always       -       4
  3 Spin_Up_Time                                                     0x0027   176   175   021    Pre-fail  Always       -       6158
  4 Start_Stop_Count                                                 0x0032   100   100   000    Old_age   Always       -       868
  5 Reallocated_Sector_Ct                                            0x0033   200   200   140    Pre-fail  Always       -       0
  7 Seek_Error_Rate                                                  0x002e   200   200   000    Old_age   Always       -       0
  9 Power_On_Hours                                                   0x0032   083   083   000    Old_age   Always       -       13046
 10 Spin_Retry_Count                                                 0x0032   100   100   000    Old_age   Always       -       0
 11 Calibration_Retry_Count                                          0x0032   100   100   000    Old_age   Always       -       0
 12 Power_Cycle_Count                                                0x0032   100   100   000    Old_age   Always       -       149
192 Power-Off_Retract_Count                                          0x0032   200   200   000    Old_age   Always       -       14
193 Load_Cycle_Count                                                 0x0032   200   200   000    Old_age   Always       -       853
194 Temperature_Celsius                                              0x0022   119   104   000    Old_age   Always       -       31
196 Reallocated_Event_Count                                          0x0032   200   200   000    Old_age   Always       -       0
197 Current_Pending_Sector                                           0x0032   200   200   000    Old_age   Always       -       0
198 Offline_Uncorrectable                                            0x0030   100   253   000    Old_age   Offline      -       0
199 UDMA_CRC_Error_Count                                             0x0032   200   200   000    Old_age   Always       -       0
200 Multi_Zone_Error_Rate                                            0x0008   200   200   000    Old_age   Offline      -       0

SMART Error Log Version: 1
No Errors Logged

SMART Self-test log structure revision number 1
Num  Test_Description    Status                  Remaining  LifeTime(hours)  LBA_of_first_error
# 1  Short offline       Completed without error       00%     13025         -
# 2  Short offline       Completed without error       00%     13001         -
# 3  Short offline       Completed without error       00%     12983         -
# 4  Short offline       Completed without error       00%     12973         -
# 5  Extended offline    Aborted by host               10%     12973         -
# 6  Short offline       Completed without error       00%     12929         -
# 7  Short offline       Completed without error       00%     12906         -
# 8  Short offline       Aborted by host               10%     12884         -
# 9  Short offline       Completed without error       00%     12866         -
#10  Short offline       Aborted by host               10%     12866         -
#11  Short offline       Completed without error       00%     12835         -
#12  Short offline       Completed without error       00%     12811         -
#13  Extended offline    Completed without error       00%     12799         -
#14  Short offline       Completed without error       00%     12763         -
#15  Short offline       Completed without error       00%     12739         -
#16  Short offline       Completed without error       00%     12715         -
#17  Short offline       Completed without error       00%     12691         -
#18  Short offline       Completed without error       00%     12667         -
#19  Short offline       Completed without error       00%     12643         -
#20  Extended offline    Completed without error       00%     12627         -
#21  Short offline       Completed without error       00%     12595         -

SMART Selective self-test log data structure revision number 1
 SPAN  MIN_LBA  MAX_LBA  CURRENT_TEST_STATUS
    1        0        0  Not_testing
    2        0        0  Not_testing
    3        0        0  Not_testing
    4        0        0  Not_testing
    5        0        0  Not_testing
Selective self-test flags (0x0):
  After scanning selected spans, do NOT read-scan remainder of disk.
If Selective self-test is pending on power-up, resume after 0 minute delay.

